<?xml version="1.0" encoding="UTF-8"?>
<student xmlns:xsi="http://www.w3.org/2001/XMLSchema-instance"
         xsi:noNamespaceSchemaLocation="Schema_Address.xsd"
         id="S101" year="2025">

  <name>Shiv Kotak</name>
  <age>20</age>
  <course>BSc IT</course>

  <address>
    <street>123 GLS Road</street>
    <city>Ahmedabad</city>
    <pincode>380009</pincode>
  </address>

</student>
